address,category,date,is_foreigner,lat,lng,name,reviews,stars
대구 달서구 공원순환로 36,, 2017년 8월,1,128.5588102,35.8509043,대구 두류 공원,"큰 공원큰 공원이 스태디움은, 워터 파크 등이 아이들 놀이터가 있습니다. 진짜 구분할 기능",2.0
대구 달서구 공원순환로 36,, 2017년 6월,1,128.5588102,35.8509043,대구 두류 공원,"도시 숲 언덕 위에긴 시간을 돌아 다니는 쉽게 공원, 다양한 경로 들이 있어서, 어떤 도전, 부드러운 몇 가집니다. 좋은 곳을 그늘지 확인할 야외 sun 수도 있습니다.",4.0
대구 달서구 공원순환로 36,, 2017년 6월,1,128.5588102,35.8509043,대구 두류 공원,"아름다운 공원이 곳은 정말 마음에 들었습니다. 겨울이 어떤지는 잘 모르겠다, 정말 아름다운 여름 이지만 꼭다발과. 가족들과 함께 방문하기 좋은.",5.0
대구 북구 산격2동 1676,, 2017년 3월,1,128.6132633,35.9071971,엑스코,조직 된 컨벤션 센터우리는 무역 박람회에 참가했고 exco에 실속을했습니다. 대구에는 대규모 컨벤션 홀과 비즈니스 센터 및 restuarants 등의 시설이 잘 갖춰져 있습니다. wifi 시설은 일관성이 없었고 대부분의 호텔은이 곳과 멀리 떨어져있었습니다.,4.0
대구 북구 산격2동 1676,, 2015년 9월,1,128.6132633,35.9071971,엑스코,이벤트에 따라 달라집니다엑스코 기본적인 컨벤션 센터에 위치한 도시. 가는 가치가 있는 경우 해당 이벤트 전시 에 관심.,2.0
대구 북구 산격2동 1676,, 2015년 3월,1,128.6132633,35.9071971,엑스코,"흥미로운 전시나는 트릭 아트 전시회와 엑스코 대한 이 재미 있었어요. 하지만 저는 줄을 얻을 수 있기 때문에 일찍 가세요. 또한, 이 지역을 찾기 어려울 수 있어서 더 좋은 택시를 타고 버스에 의지할 수 있습니다. ",4.0
대구 북구 산격2동 1676,, 2015년 11월,1,128.6132633,35.9071971,엑스코,좋은 장소우리는 4일의 회의에서 partipated 엑스코 티씨아이 - 네트워크. 머물기 좋은 곳이었습니다. 물류 개선되어야 할 수 있.,4.0
대구 북구 산격2동 1676,, 2015년 9월,1,128.6132633,35.9071971,엑스코,"ELSA2015그랜드 오프닝 ceromony. 아시아의 외과 의사 내시경 배안보개. 신과 주요한 큰 복도,, 참가자 이상의 충분한 2000",4.0
대구 가창면 가창로 1003,, 2018년 8월,1,128.6265451,35.793695,힐크레스트,최악입니다!시간 낭비하지 마세요. . . 돈을 노력. 모든 것이 문을 닫습니다. 할 일이 없다. 완전히 변합니다. . . 왜 말 그대로 때 티켓 판매 모르겠습니다. . . 아무것도 할 수 있습니다. 웹사이트는. . . 녹차 나가서 자야했다구 일부 죽은 덤불. . . 허브 가든이 정원이 있는 사용하는 Ivergorwn 난장판이죠. 그냥 마세요,1.0
대구 가창면 가창로 1003,, 2017년 5월,1,128.6265451,35.793695,힐크레스트,"어드벤처 파크허브 힐즈도 ""힐 크레스트 (Hill Crest)""라는 멋진 공원으로 알려져 있으며, 우편 번호 트랙을 추적했습니다. 그들은 성인용 또는 17 세 이상 동안 아이들과 킹콩을위한 2 단계 고릴라를 가지고 있습니다. 당신은 대구의 버스 터미널 413 번 버스를 타면 대구에 있으면 교통량에 따라 약 45 분이 걸리며 지퍼 라인을 포함한 나무에서 매달려있는 모든 것이 약간의 적합성을 필요로하지만 실제로해야 할 일은 24 가지가 넘습니다 드라이버 ""Hill Crest""",5.0
대구 가창면 가창로 1003,, 2017년 3월,1,128.6265451,35.793695,힐크레스트,"잘못 관리 된 지역한국과 블로그를 읽은 후, 친구들과 나는 왕의 코스와 다른 활동을 위해 허브 힐즈 (Herb Hillz)로 여행하기로 결정했습니다.  우리가 약초 언덕의 입구까지 경사를 걸어야했기 때문에 대중 교통을 이용하여 도착하는 것은 꽤 긴 여정이었고 그만 쉽게 놓칠 수있었습니다.  보도의 입구가 잘 유지되면서 장소의 첫번째 인상은 꽤 담담했다.  티켓 리셉션 직원은 기본 영어와 의사 소통을 할 수 있지만 킹콩 코스에 대한 비용 설명은 정확하게 이해할 수 없습니다. 그래서 우리는 kong 코스를 결정하기",1.0
대구 가창면 가창로 1003,, 2017년 2월,1,128.6265451,35.793695,힐크레스트,"떨어진 것은 아무것도 할 수 있는 에코 어드벤처저희는 king kong 코스. 하지만 너무 많은 곳에서 쉽게 보는 것 같은 것을 거에요. 내 남자 친구가 필요한 수 아래로 반 쯤 통해 손쉽게 완료할 수 있지만. 물론 아주 안전하긴 하지만. 두 개 이상의 에코 어드벤처, 작은 아이들이 있는 대상. 피자가 맛있는 곳!",4.0
대구 가창면 가창로 1003,, 2016년 12월,1,128.6265451,35.793695,힐크레스트,"겨울 은 그다지 좋지이번이 첫 번째 방문은 흥미로운 곳이 많지만 갈수록, 다양한 것들이 머물렀는데요. 저희가 간 시원한, 화창한 날이 사용자_이름:. 우리는 눈이 지원하지만 기대 할 뿐 아니라 시스템 또는 눈 썰매 언덕 중인 동안 200 명 서 기다리고 있는, 작은 언덕이 있고 아주 작은 수 많은 방문객들도 을 수용하지 않을 것 같다. 본 경우 이 로그인 시 사용할 기본 나타내는 산 언덕 오르기 때문에 눈도 나를 본 사람들은 서 하지 않을 정도. 이 곳을 방문하는 것이 라기 보다는 봄에 다시 시도하십시오, 하며",3.0
대구 수성구 유니버시아드로 180,, 2018년 2월,0,128.690203,35.8298301,대구스타디움,심심할때 가기 딱입니다.대구스타디움이 대구에서 유명한 경기장이라고 들어서 갔는대 선수들이 열심히 운동하는 모습이 만족스럽습니다. 가족이나 친구랑 같이 가면 좋겠습니다.,5.0
대구 수성구 유니버시아드로 180,, 2017년 4월,0,128.690203,35.8298301,대구스타디움,"스타디움, 영화관, 쇼핑, 마트, 모든것이 한곳에스타디움은 대구FC의 홈구장입니다 아주 큰 경기장이라서 큰 행사가 열리는 곳이기도 합니다 그리고 주변에는 영화관과 쇼핑몰 마트가 있어 언제나 사람들이 끊이지 않습니다 ",4.0
대구 수성구 유니버시아드로 180,, 2017년 8월,0,128.690203,35.8298301,대구스타디움,미술관근처cgv 홈플러스 카페 식당 다있는 장소에요 드라이브겸 가면 좋을것같아요  미술관도 근처에있으니 한번들려보세요,4.0
대구 수성구 유니버시아드로 180,, 2017년 5월,0,128.690203,35.8298301,대구스타디움,"스타디움자체는 볼것이 없습니다월드컵경기때문에 만들어진 경기장인데 스타디움자체는 그닥 볼것도 할것도 없습니다. 그런데 주변에 가족끼리 와서 산책하고 피운동할수 있는 환경은 좋습니다, 근처에 홈플러스와 cgv극장 등신코스가 있어서 그나마 좋습니다.",2.0
대구 수성구 유니버시아드로 180,, 2016년 6월,0,128.690203,35.8298301,대구스타디움,멋진 종합 육상 및 축구 경기장세계 육상대회 및 월드컵을 치른 대구 스터다움은 멋진 체육 시설과 주변 산책 공간으로 대구 시민의 휴식 공간이자 대구 FC의 홈 구장이다 주변 쇼핑몰 및 영화관도 갖추어져 있고 숲으로 이루져 있어 산책 및 주변 자전거 롤러 스케이트 타기도 적절하다   보조 경기장도 일반에게 걷고 뛰도록 열어 놓고 일부 주 경기장 내 시설도 매일 열어서 경기장을 상시 돌아 볼 수 있다 주변 주차장도 넓어서 매우 좋고 특히 가을 및 봄 피크닉 하기 좋은 나무와 잔디로 갖추어진 대구 종합 쉼터이기도 하다,4.0
대구 중구 포정동 21,, 2017년 8월,0,128.5922224,35.8722155,경상감영공원,"도심속 작은 오아시스경싱감영공원은 말 그대로 지금의 도청 같은곳으로 조선시대 경상도의 도청청사였던 곳입니다. 도심 빌딩속에 나무와 한옥과 작은정자 까지 있어 도심의 오아시스같은 역활을 하는곳입니다. 지하철 중앙로역에서 아주 자까우며 봄에는 여러 꽃들이 피고 7,8월에는 맥문동과 배롱나무 꽃들이 만발하여 유적지의역활과 산책과 그냥 편히 휠링할수 있는 휴게소 같은 곳입니다. ",3.0
대구 중구 포정동 21,, 2017년 7월,0,128.5922224,35.8722155,경상감영공원,사진만큼 아름답지는 않다.적당히 산책하기는 좋으나 노인들이 많고 무엇보다 유해동물이자 혐오동물에 가까운 비둘기들이 많이 서식한다.,3.0
대구 중구 포정동 21,, 2016년 2월,0,128.5922224,35.8722155,경상감영공원,대구근대문화거리의 종착점전라감영은 구 전북도청이 있어서 없어졌지만 이 곳은 공원 형태로 보존해서 신기했습니다. 지금은 휴식처로 보존되서 신기했습니다. 이 곳을 기점 혹은 종점으로 근대문화유산을 볼 수 있을 듯합니다. 근처에 박물관이 있는데 월요일에는 쉬어서 방문하지는 못했습니다.,4.0
대구 중구 포정동 21,, 2015년 8월,0,128.5922224,35.8722155,경상감영공원,도심속에 있어 좋습니다.도심과 가까워 관광하기에 편리합니다. 조선시대 관찰사가 감영을 하던 건물이 있는 곳입니다. 녹음 짙은 나무들이 많아서 휴식처로써 기능을 하고 있습니다.,4.0
대구 중구 포정동 21,, 2016년 6월,0,128.5922224,35.8722155,경상감영공원,"근대문화거리의 명물대구시의 옛 모습을 보여주는 감영이다. 현재는 시민들의 휴식처로 이용되고 있지만, 조선의 역사가 깃들여 있는 유서 깊은 유적지다. 그 주변에는 근대문화유산 박물관을 비롯해 다양한 유적들이 흩어져 있다. 거기에 다양한 골목을 볼 수 있는 것도 바로 이 주변이다.",5.0
대구 중구 서성로 10,, 2016년 7월,1,128.5879943,35.8677053,천주교 계산 주교좌 성당,"성당, 다른 사람들처럼특별한 것은, 중요한 대성당이 있는 중심에 대구. 짧은 방문할 가치가 있고, 주변 지역에 있는 경우",3.0
대구 중구 서성로 10,, 2015년 10월,1,128.5879943,35.8677053,천주교 계산 주교좌 성당,"대구에서 좋은 고딕 성당이 성당은 대구, 근처에 있는 다른 역사적인 지역. 멋지고 조용하고 아주 예쁜.",4.0
대구 중구 큰장로26길 45,, 2016년 5월,1,128.580781,35.8688986,서문 시장,"거대한!이 시장이 ginormous 한. 많이 보고, 냄새가 나고! 좋은 음식과 좋은 사람들. 이는 좋은 문화 체험. 나의 방황 하는 파는 가게들이 많은 관광객들이 완전히 즐겼다. 호떡 을 구입! ",4.0
대구 중구 큰장로26길 45,, 2016년 3월,1,128.580781,35.8688986,서문 시장,"좋은 곳나는 몇 년 동안 기본적으로 아무것도 찾을 수 있는 이 시장에서 옷 모든 종류의 음식이 이상한 일. 특히 한국 스타일의 옷 아리마를 테일러 의 한, 좋은 위치에 - 전통적으로 옷을 입어. 제가 구입한, 곡물, 누룩 magkeolli 주고, 재료 주 트렁크. 이 지역은 거대한 중에 한국에서 가장 큰 직물. 이와 같은 길을 잃기 쉬울 수 있는지 정확히 알고 있는 경우 저장할 위치를 쉽게 찾아 두 번 정도 않을때 수 있습니다. 또한, 고려 쿨러 하루 중에서 / 습도 및 열 계획입니다.",5.0
대구 중구 큰장로26길 45,, 2015년 9월,1,128.580781,35.8688986,서문 시장,전통적인 한국인 중에서 가장 큰 시장!이 시장은 정말 크고 특별한 음식을 찾을 수 있는 옷 등등이 항목!,4.0
대구 중구 큰장로26길 45,, 2015년 8월,1,128.580781,35.8688986,서문 시장,좋은 시간제가 맛있는 한국 음식을 찾고 사 후라잉된. 모두가 함께 있는 정말 멋진 기타 nicknacks. 나는 적어도 한달에 한 번 다시 가고 싶어요.,4.0
대구 중구 큰장로26길 45,, 2016년 3월,1,128.580781,35.8688986,서문 시장,"거대한, 저렴한 가격에 출시!전통적이고 오래된 시장은 한국에서 찾을 수 있는, 한 마디 - 저렴한! 그들은 모든 것을 표시하여 최대 50% 이상. 스카프를 하나 샀는데, 87000 키블록 에, 덕분에 56000, 나쁜 것도 아니니까? 좋은 음식에 시장, 전통적인 대구 가 만두 한 ' 가 삽입된 아주 좋은! 많고 많은 건물들이 길을 잃고 싶지 않다면 에, 가기 전에 지도와 안내 데스크, 실내 및 야외에 사용할 수 있습니다.",4.0
대구 달서구 두류동 산 302-11,,,0,128.5634167,35.8540248,이월드,"가족 휴식 공간아이들에게 너무나도 재밌는 곳이에요! 제 것은 그리 오래되지 않아서, 타보지는 않았어요. 워싱턴에 있는 자연 물살보다 좋았지만, 아이다호나 디즈니랜드에 있는 silver wood는 없었습니다. 그러나 가족끼리 정말 좋은 시간을 보냈습니다. 아마 시즌권은 가치가 없을 것 같아요.",4.0
대구 달서구 두류동 산 302-11,,,0,128.5634167,35.8540248,이월드,가족과 가기에 좋습니다! 가족 혹은 친구들과 같이가면 재미있어요. 재미납니다.우리는 E-world에서 신나는 경험을 했습니다. 볼거리가 많았습니다. 꼭대기에 꼭 가보세요. 그리고 77층에 있는 회전하는 레스토랑에서 식사하세요. 너무 재미납니다. 2013년 4월에 처음으로 가족들과 방문했어요. 꼭 다시 가볼 겁니다.,4.0
대구 달서구 두류동 산 302-11,,,0,128.5634167,35.8540248,이월드,작은 것을 선택하세요.굉장히 큰 테마파크는 아니지만 재미난 것이 많습니다. 미니 롤러코스터와 몇개의 위아래가 뒤집히는 탈것이 있습니다. 기대한 것보다 많은 놀이기구가 있었습니다. 그러나 스릴이 넘치지는 않았습니다.,3.0
대구 달서구 두류동 산 302-11,,,0,128.5634167,35.8540248,이월드,위험을 감수하세요.최신의 테마파크는 아닙니다. 그리고 몇몇 무서운 놀이기구가 있지만 그게 경험할 수 있는 전부입니다. 전적으로 같이 가는 사람들에게 달려있습니다. 타워에 갈 수 있게 시간을 꼭 내세요 그리고 멋진 도시 전경을 보세요. 타워 밑에 있는 매직 아이 박물관이 가장 마음에 드는 것 중 하나였습니다. 그곳에서 친구들과 정말 멋진 사진을 찍었습니다.,4.0
대구 달서구 두류동 산 302-11,,,0,128.5634167,35.8540248,이월드,"시간이 있다면 좋은 곳 입니다.남는 시간이 조금 있다면 좋은 장소입니다. 다른 나라에 있는 많은 테마파크들과 비교할 것은 없지만 기본적인 것은 있습니다. 몇개의 롤러코스터와 미끄럼틀 기구, 바이킹 등등 이 있었습니다.   전일입장료는 대략 성인 한사람당 28000원이고 모든 기구를 탈 수 있습니다.    줄은 하루종일 길지 않았고 가장 오래 기다려봤자 30분 이었습니다.  어린 아이들이 할 수 있는 활동들이 많았습니다.  안에 들어가서 먹을 수 있는 곳이 정말 많았습니다. 모든 시설들이 깨끗하고 상태가 좋았습니다. ",3.0
대구 북구 산격2동 1676,, 2015년 9월,1,128.6132633,35.9071971,엑스코,갈 일이 있을때 주차가 편해서 좋아요딱히 엑스코를 설명하자니 ㅎㅎ 세미나 있어서 방문했구요. 한꺼번에 많은 차를 주차할 수 있어서 그점은 좋네요. 세미나 시즌에는 정말 많은 차가 한꺼번에 들어가고 나가고 해서... 그런데 이럴때 조차도 주차비 할인이 안되는게 영 그렇네요. 하루주차 6000원씩  그 많은 차량이 다 돈으로 보이더군요.ㅎㅎ 1층 스타벅스를 자주 이용하구요. 점심시간에 사람이 몰리니 주문하는데 줄이 길어서 시간이 좀 걸리니 점심시간 짧을땐 조금 맘이 급하구요. 엘리베이터가 곳곳에 있지만 몰리는 곳에만 사람이 많아,4.0
대구 북구 산격2동 1676,, 2015년 8월,1,128.6132633,35.9071971,엑스코,전시회로 자주 가요전시회등으로 자주 들르는 곳입니다.  주변에 먹거리가 좀 한정적이어서.. 그것빼고는 최근 증축하여 건물 내외부도깨끗하고 시설도 좋습니다. ,4.0
대구 북구 산격2동 1676,, 2015년 4월,1,128.6132633,35.9071971,엑스코,"MICE선진 도시 대구로 오시와용!사이즈는 부산이나 서울에 비해 약소하나 내부 시설이나 직원들 프로페셔날리즘은 대한민국 최고인듯, 아울러 오디토리움도 제법 쓸 만 했고 특이한것은 태양력을 이용해서 시설에 활용한다고함",4.0
대구 북구 산격2동 1676,, 2014년 9월,1,128.6132633,35.9071971,엑스코,"공연 볼 때 방문공연, 베이비페어 등등으로 방문해 봤습니다. 주차도 편리하고 깨끗합니다. 1층에 스타벅스가 입점해있어요",5.0
대구 북구 산격2동 1676,, 2019년 9월,1,128.6132633,35.9071971,엑스코,절대적으로 멋진 건축우리는 Exco에서 일주일-긴 회의를 가졌습니다. 가장 먼저 주목해야 할 것은이 컨벤션 홀의 크기입니다. 거대합니다. 한 번에 만 명 이상을 수용 할 수 있습니다. 괜찮은 음식이 있지만 좋은 커피는 좋은 카페가 몇 군데 있습니다. 그 외에도 볼 것이 많지 않습니다. 여기서 회의에 참석하지 않으면 이곳을 방문 할 가치가 없습니다.,5.0
대구 북구 산격2동 1676,, 2015년 5월,1,128.6132633,35.9071971,엑스코,"여행은 좋은 날저는 다섯 시 가 엑스포 엑스포지션 모두 다 볼 만한 - 차, 커피, 꽃, 화장, 고양이 /개. 큰 장소, 채광 및 엑스포지션 모두 아름답게 구성되어 있습니다. 이는 높은 품질의 상품. 대부분의 질문에 답변할 수 있는 충분한 영어를 구사하는 담당자가 있습니다. 쉽게 액세스 해 걸어서 버스를 타고. 있는 음식, 숙박 및 쇼핑 지역도. 특히나 사랑하는 강아지 / 고양이 공연 해설 이 다음에 다시 참석하고 싶어요.",5.0
대구 달서구 공원순환로 36,, 2016년 10월,1,128.5588102,35.8509043,대구 두류 공원,"거대한 공간에서 길을 잃기저는 거짓말을하지 않습니다, 손실이 큰 공원을 돌아다니고, 매우 가파른 길 의 일부. 않으려고 하지 않았다 는 가장 가까운 지하철역인 어디 있는지 알 지도 아래 두어 결국 택시를 우리 집.  가장 큰 문제는 정보가 부족하여 보이고.",3.0
대구 달서구 공원순환로 36,, 2016년 10월,1,128.5588102,35.8509043,대구 두류 공원,시티 파크 주요 관광 명소 83 타워 에 있는 놀이 공원이 있고 공원. 이 공원은 큰 피해 갈지 수 시간이 걸립니다. 가까운 지하철역인.,4.0
대구 달서구 공원순환로 36,, 2016년 10월,1,128.5588102,35.8509043,대구 두류 공원,아름다운 공원절대적으로 아름다운 공원 이다. 화창한 날에 방문한 즐거운 자연 관광지. ,5.0
대구 달서구 공원순환로 36,, 2016년 4월,1,128.5588102,35.8509043,대구 두류 공원,"큰 도시에서 좋은 큰 공원바쁜 도시에 있는 큰 공원, 놀라운 특별한 것은 아니고, 아직 벚꽃 은 봄, 날짜 또는 간단한 산책이 좋은 공원에서. 주변에 자전거를 대여할 수 있는 자전거 :) ",4.0
대구 달서구 공원순환로 36,, 2015년 4월,1,128.5588102,35.8509043,대구 두류 공원,근사한 시티 파크도시 공원은 산책 또는 조깅에 좋은 곳입니다. 좋은 커피 카페들이 쉴 수 있다.,3.0
대구 중구 큰장로26길 45,, 2016년 2월,1,128.580781,35.8688986,서문 시장,"너무 많은 것을! 시장에 간다면, 지도를 얻는 가기 전에 모든 일들이 목적 없 이 방황 하고 싶지 않다면. 처음 방문한 것도 있었지만 3시간을 걸어 다니는 경우는 찾을 수 없는 것을 확인하는 내부에 있기 때문에 특정한 고려를 하지 않았습니다. 이제 내가 5 시간 전에 제가 아는 이상 :) 저는 제 가지도 검색하여 앞서 를 타고 시장. 많은 주차 공간이 있지만 결정한 경우 드라이브 전체 시장에서 시장은 지하철 역에 있는 본당 krisy.",3.0
대구 중구 큰장로26길 45,, 2016년 2월,1,128.580781,35.8688986,서문 시장,"흥미로운 방문 시 서문 시장 저는 보고 싶어하는 시장에서 인기가 많은 곳이어서 항상 도시들을 방문합니다. 이 상자는 서문 시장의 레이스를 볼 수 있어서 고물 을 완료하는 데 서쪽의 다른. 시장은 꽤 큰 곳에서 길을 잃기 쉽게 할 수 있습니다. 시장은 검사기,인텔 차의 문제가 발생하지 않은 좋은 큰 파크인 했죠. 대중 교통을 이용하면 버스, 택시도 보이는 정말 멋진 도시. 많은 현지 음식을 시도해 보지만 스스로 해 볼 수 있는 위험 요소; ) ",4.0
대구 중구 큰장로26길 45,, 2016년 2월,1,128.580781,35.8688986,서문 시장,"또 다른 한국 시장이 큰 시장 이지만 정말 아무것도 다른 큰 한국 시장 차별화되는. 할 수 있는 다양한 상품, 의류, 재료, 음식, 신선한 고기, 신선한 과일, 등이 있습니다. 많은 사람들이 있었기 때문에 매우 좋습니다(플라스틱이 civered. 몇 가지 작은 먹을 곳, 순수하게 한국 음식을. 할 정도로.",3.0
대구 중구 큰장로26길 45,, 2016년 1월,1,128.580781,35.8688986,서문 시장,"모든 필요와 그 이상전형적인 아시아 시장. 찾을 수 있는 음식, 옷을 다른 많은 것들을. 많은 작은 상점을.",4.0
대구 중구 큰장로26길 45,, 2016년 1월,1,128.580781,35.8688986,서문 시장,"인근의 역사적인 장소에 아주 좋은 곳. 서문 시장은 매우 큰 시장.  서울에 있는 남대문 시장이 큰 것처럼 보인다.   5 부분이 서로 다른 기능을 업계에 큰.   모노레일을 방문할 수도, 선교 의 집, 학교 근처에 위치한 그러한 gyeoseong.   3.1 독립 운동 이라는 gheongra 언덕 올라가지 언산.   좋은 경험이 있을 것이다 (팬케이크) ssiat hoddeok.    :)  ",5.0
대구 수성구 유니버시아드로 180,, 2016년 4월,1,128.690203,35.8298301,대구스타디움,어마어마한 경기장대구FC의 전용구장이면서 2011년 세계육상경기대회와 유니버시아드대회의 메인 스타디움으로 이용된 곳으로 큰 규모와 좋은 시설과 아름더운 주변 경관으로 대구시민의 휴식처가 되는 곳이다. ,5.0
대구 수성구 유니버시아드로 180,, 2015년 7월,1,128.690203,35.8298301,대구스타디움,2002월드컵의 추억이 담긴곳2002월드컵때 대한민국 대표팀이 미국전과 터키전을 했던 경기장입니다. 잠실종합운동장과 비슷한 규모이고 현재는 프로축구 챌린지 대구fc가 홈구장으로 사용하고 있습니다.,4.0
대구 수성구 유니버시아드로 180,, 2015년 6월,1,128.690203,35.8298301,대구스타디움,엄청난 크기스타디움 크기가 엄청나죠~ 관중석을 다 채우기가 힘들어요. 행사차 한번 갔는데 많은 인원이 모였음에도 불구하고 자리가 많이 남더군요. 주변에 공원이랑 같이 있어서 운동하는 사람들 산책하는 사람들 많아요. 대구에서도 외지에 있다보니 기온이 뚝뚝 떨어집니다. ,3.0
대구 수성구 유니버시아드로 180,, 2016년 3월,1,128.690203,35.8298301,대구스타디움,"대구의 종합경기장대구 스타디움은 원래 대구 월드컵 경기장이라는 이름의 종합 경기장이었다. 대구 FC의 홈 경기장이지만 종합경기장이므로 육상 경기도 할 수 있어서, 경기장과 관중석 사이의 거리가 매우 멀다. 아쉬운 점은 지하철에서 경기장까지 거리가 매우 멀다는 점. 축구 경기 당시에는 셔틀 버스를 운영한다.",5.0
대구 수성구 유니버시아드로 180,, 2017년 3월,1,128.690203,35.8298301,대구스타디움,"스포츠 팬을보아야하는 경우우리가 지역에 있었던 경기장 날에 들어갈 수 없었다. 매우 인상적인 시설. 시설에 인접한 경기장 주변의 녹색 공간과 쇼핑몰은 쇼핑하고 먹을 수있는 장소를 제공했습니다. 우사 인 볼트가 불쾌한 ""번개""자세를 취하는 모습을보아야합니다. 또한 경기장 맞은 편에있는 스포츠 박물관을 방문하십시오.",5.0
대구 중구 포정동 21,, 2016년 4월,0,128.5922224,35.8722155,경상감영공원,"대구의 휴식처대구 시내에 위치한 3개의 공원 중 하나이다. 옛날 경상도를 관할하던 경상 감영이 있던 위치에 지어진 공원으로서, 종각에 올라가면 제법 멋진 광경을 볼 수 있다. 틈틈히 이벤트들도 벌어지고, 노인들이 쉬러 많이 나오는 공원이다.",4.0
대구 중구 포정동 21,, 2016년 2월,0,128.5922224,35.8722155,경상감영공원,학창시절부터 자주 가던 곳감영공원에 가면 어르신들이 많이 계시긴 하지만 대구의 역사를 간직하고 있는 공원이라 대구 방문시에 시간이 되면 시내 가는 길에 한 번 들러보길 추천합니다. 고즈넉하고 시내 근처에 있는 공항이지만 조용해서 마음이 힐링 되는 그런 곳 ,5.0
