address,category,date,is_foreigner,lat,lng,name,reviews,stars
대구 달서구 두류공원로 200,, 2020년 5월,0,128.5634167,35.8540248,83 타워,"대구 야경보기 좋은 곳대구에 살지만 가까이 있어 다 안가게 되던 곳인데 코로나로 인해 다른 지역 가지 못 해 방문. 전망대엔 1인 만원의 입장료가 있지만 가격 대비 괜찮음. 식당, 카페도 있지만 안전을 위해 패스. 대구 오면 야경 보러 꼭 오길 추천.",5.0
대구 달서구 두류공원로 200,, 2019년 11월,0,128.5634167,35.8540248,83 타워,83타워이월드와 더불어 83타워도 좋았습니다. 특히 밤에 가면 야경이 진짜 멋있습니다. 진짜 전망대 야경이 환상적이고 아름다워서 좋았습니다.,5.0
대구 달서구 두류공원로 200,, 2019년 5월,0,128.5634167,35.8540248,83 타워,대구의 남산타워생각보다 경치가 좋습니다. 야경 보러 가기 좋아요. 근처에 벚꽃도 예쁘게 피고 관등축제도 5월에 하니까 한 번 쯤 가보는 걸 추천.,4.0
대구 달서구 두류공원로 200,, 2019년 5월,0,128.5634167,35.8540248,83 타워,"대구의 랜드마크. 걸어서 가면 언덕길이 엄청 경사짐. 이랜드 입장 티켓 하우스 직원, 83타워 전망대 티켓 박스 직원 응대가 그리 친절하지는 않음.  전망대 자체는 그럭저럭 볼만하나, 퇴실 경로를 거지 같이 만들어 놓음.    그냥 한번쯤 생각없이 갈만한곳이나 두번은 가기 싫은곳.   타임캡슐 우체통에 넣을 우편물을 위해서는, 필요한 정보의 모든 항목(주소 우편번호 받는사람 보내는 날짜 등)을 기입 할 수 있는 양식 폼 스티커를 만들어서 필요한 사람은 편지지에 붙여서 사용 할 수 있도록 해 주면 좋겠음. ",3.0
대구 달서구 두류공원로 200,, 2018년 11월,0,128.5634167,35.8540248,83 타워,리뉴얼리뉴얼 되고 나서는 괜찮더라구요 특히나 꼭대기층에서 친구랑같이 디저트 먹는 에프터눈 티세트 해보았는데 고급? 스런 느낌나고 좋았어요,4.0
대구 남구 앞산순환로 574-116,, 2020년 7월,0,128.5890545,35.8289965,앞산공원,전망이 짱좋아요밤에 앞산공원 야경보러 갔는데 대구 시내도 다보이고 정말 이쁘네요. 대구 놀러오시면 꼭 가보세요. 밤에 가는 걸 추천 드려요.,5.0
대구 남구 앞산순환로 574-116,, 2020년 2월,0,128.5890545,35.8289965,앞산공원,아침 식사 및 산책주변에 카페 식당 등이 경치 좋은곳에 위치 하고 순환 도로랑 연결되어 있어 접근성도 좋음. 앞산은 공원화 되어 있고 해서 한나절 보내기 좋은곳임,3.0
대구 남구 앞산순환로 574-116,, 2018년 12월,0,128.5890545,35.8289965,앞산공원,"앞산 전망대 좋습니다.앞산 전망대에 올라갈 수 있으며, 날씨 좋을때 올라가면 뷰가 좋아서 사진찍기좋습니다. 야경 구경하기에도 좋습니다. 가벼운 산책,등산하기도 좋습니다.",5.0
대구 남구 앞산순환로 574-116,, 2019년 6월,0,128.5890545,35.8289965,앞산공원,"야경도 보고 편지도 쓰고느린우체통 설치 잘한거 같습니다.  연인, 친구, 가족 간에 의미를 담은 편지도 쓰고 아이디어 gooood 입니다.  저도 아내와 아이들에게 엽서를 적어 보냈는데....  엽서가 기다려지네요.",5.0
대구 남구 앞산순환로 574-116,, 2018년 4월,0,128.5890545,35.8289965,앞산공원,외국 손님 관광을 위해.날씨가 좋은날 저녁에 올라가서 야경이나 일몰을  보면 좋음. 케이블카가 야경을 보고 내려올 수 있도록 운행함. 동절기 하절기 운행 시간이 달라 확인 해 보고 갈 것을 권유함.,5.0
"대구 Dohak-dong,Dong-gu",, 2020년 6월,0,128.7138793,35.9892801,동화사,세계 최대석불이 있는 곳종교가 불교는 아니지만 팔공산에 가서 코로나 때문에 사람이 별로 없는 곳을 찾아보다 방문. 어릴 적 추억을 곱씹으면서 아이와 간단한 등산하기에 좋음. 불교에 대해 무지하지만 거대한 통일불을 보면 웅장함이 느껴짐. 대구로 여행을 온다면 꼭 들려보기를 추천!!,4.0
"대구 Dohak-dong,Dong-gu",, 2019년 6월,0,128.7138793,35.9892801,동화사,최고 대구 명소중 하나입장료는 2500원이고 버스타고 동화사역에서 내려 좀 들어가면 매표소가 있다. 첫번째로 나의 이목을 끌었던것은 입장권을 구입하고 큰문을 들어서자 마자 펼쳐지는 풍경이었다 양쪽으로 산이 자리하고 있으며 왼쪽에는 좀 큰 연못이 있으며 한 가운데에 연꽃 장식이 배치되어 있다. 또한 뒤쪽에는 스님들의 무덤이 약 10개 정도가 있는데 이 모든것이 주변의 자연 풍경과 어우러져 매우 수려했으며 마치 무릉도원에 들어온것 같았으며 매표소 와는 전혀 다른 세계 같았다. 우측으로는 동화사가 자리하고 있고 좌측으로는,5.0
"대구 Dohak-dong,Dong-gu",, 2019년 5월,0,128.7138793,35.9892801,동화사,시끌벅적한 절.규모가 큰 건 둘째 치고 상당히 시끄러웠던 절. 사람이 정말 많습니다. 그리고 스님이 기타치고 버스킹 공연하는 건 나름 문화충격.,4.0
"대구 Dohak-dong,Dong-gu",, 2019년 1월,0,128.7138793,35.9892801,동화사,"역사와 전통이 느껴지는 곳팔공산에 위치한 동화사는 인근에 시민안전테마파트와 케이블카를 타고 올라가면 대구 전경을 볼 수 있는 하늘정원이 있어 사시사철 연인, 가족과 함께 갈 수 있는 여행지다",5.0
"대구 Dohak-dong,Dong-gu",, 2018년 10월,0,128.7138793,35.9892801,동화사,매우 큰 절팔공산에 위치한 매우 큰 절로 산책하기 좋은 곳입니다. 그러나 건물에서 역사적인 느낌을 받기는 어렵습니다. 항상 사람이 많습니다.,4.0
대구 달성군 다사읍 강정본길 57,, 2020년 5월,0,128.4683413,35.8385261,디아크,"자전거, 퀵보드 타기 좋은 곳집에서 멀지만 바람쐬러 드라이브하러 간 곳. 야외이다 보니까 많은 사람들이 놀러옴. 디아크에 들어가서 둘러 보면 좋겠지만 실내라서 다음을 기약. 자전거, 퀵보드 타기 좋지만 왕발통 조심해야함.",5.0
대구 달성군 다사읍 강정본길 57,, 2019년 4월,0,128.4683413,35.8385261,디아크,강정보강정보 왕발통 타러갔어요 조심하셔야해요 안전도구 착용하시고  요즘 왕발통 퀵보드 많아서 재미있고 즐길수있지만 항상 안전도구 꼭 착용하시고 이용하시길,4.0
대구 달성군 다사읍 강정본길 57,, 2019년 3월,0,128.4683413,35.8385261,디아크,"날씨 좋은날 가족 나들이로 제격날씨 좋은 날, 가족 나들이로 제격인 곳 주말에는 주차 하기가 좀 힘들긴 하지만, 강 따라 자전거 전동휠 바이크 등 대여해서 놀기 좋다. 디아크는 건물 자체도 독특하고 아름답고, 내부에는 환경, 강 등과 관련된 전시를 하고 있어 한번쯤 둘러보기 좋다.",4.0
대구 달성군 다사읍 강정본길 57,, 2018년 5월,0,128.4683413,35.8385261,디아크,"아이들 있다면 필수코스자전거, 보드, 탈것들을 대여해줘서 아이들 놀기에 너무 좋아요. 유모차 가지고 한바퀴 돌기에도 잘 되어 있구요.  디아크 안에는 사실 크게 볼건 없어요. 그냥 밖에서 놀다가 오기 좋습니다.",5.0
대구 달성군 다사읍 강정본길 57,, 2018년 8월,0,128.4683413,35.8385261,디아크,디아크시원한 강 예쁜 야경 분지인 대구에서 속이 확 뚫리는 데이트 장소를 찾으신다면 디아크로 가보세요!ㅎㅎ 전동바이크타고 시원하게 강변을 달리면 스트레스가 확 풀립니다~!,4.0
대구 중구 달성로22길 31-12,, 2020년 7월,0,128.5845613,35.8755076,대구예술발전소,"달 사진 찍으러미술을 잘 모르지만 유명한 달 사진이 있다고 하여 방문. 체온측정, 손소독하고 들어가야 함. 여러 작품이 있긴 한데 의미를 잘 모르겠음. 한번 쯤 들릴만한 곳이고 달 사진은 프사용으로 적격임.",4.0
대구 중구 달성로22길 31-12,, 2019년 12월,0,128.5845613,35.8755076,대구예술발전소,특이한 작품이 있는 곳예술에 대해 문외한이지만 가볼만 한 곳. 이게 예술 작품인가 할 정도로 특이한 것이 많음. 소셜미디어에 많이 나오는 작품엔 사람들 많음. 한 번씩 들릴만함.,4.0
대구 중구 달성로22길 31-12,, 2018년 10월,0,128.5845613,35.8755076,대구예술발전소,달사진인스타나 페북에 달에서 사진 찍는게 많이나오길래 한번 방문해서 사진찍었습니다. 타이밍이 좋아야해요 저는 사람이 별로없을때 찍었는데 공짜다 보니 사람들이 몰리는 시간도있고  줄서서 기다려야합니다.,5.0
대구 중구 달성로22길 31-12,, 2019년 3월,0,128.5845613,35.8755076,대구예술발전소,"아이들이 좋아할 장소!젊은 예술인들 작품도보고, 차도 한잔마시고 어린이들은 놀이를 즐기며 좋은 시간을 보냈음. 수창맨션이랑 같이 둘러보기를 추천!",5.0
대구 중구 달성로22길 31-12,, 2016년 4월,0,128.5845613,35.8755076,대구예술발전소,"대구 예술 발전소예술가들을 위한 장소이면서, 시민들을 위한 문화 휴식처. 그래서 그런지 내부도 예술가들의 작품으로 인테리어가 되어 있고 문화 예술계를 위해 일한 사람들을 기리는 공간등도 마련되어 있으며, 만권당이라는 독서 프로젝트도 여기서 진행한다.",4.0
대구 동구 팔공산로185길 51,, 2019년 11월,0,128.6948362,35.9909143,팔공산케이블카,"팔공산 케이블카동화사와 더불어 팔공산에 왔으면 꼭 가봐야하는 필수 관광코스. 위에서 보는 경치가 아주 좋습니다. 다만, 의외로 대구 시내는 잘 보이지 않아서 아쉽.",5.0
대구 동구 팔공산로185길 51,, 2018년 12월,0,128.6948362,35.9909143,팔공산케이블카,"대구의 랜드마크 팔공스카이라인대구의 1번째 산은 팔공산!!! 팔공산의 랜드마크는 동화사,갓바위,스카이라인~ 약 1,000고지까지 케이블카를 타고 갈수 있어 동봉이나 서봉에 오르기도 편안하답니다~",5.0
대구 동구 팔공산로185길 51,, 2019년 6월,0,128.6948362,35.9909143,팔공산케이블카,"죽임!입장료는 10,500원이고 동화사 방문한 사람은 그 가격만큼 할인 적용이 된다. 우선 타고 올라가는데 길이가 꽤 되며 처음에 올라갈때 생각보다 고도가 높아서 무서웠음 하지만 시간이 지나니까 은근히 스릴 있어서 신났었음 ",5.0
대구 동구 팔공산로185길 51,, 2018년 10월,0,128.6948362,35.9909143,팔공산케이블카,"하늘 정원 가는 길팔공산 케이블카는 남녀노소, 누구나 갈 수 있는 곳이라 좋아요. 특히 케이블카를 타고 올라가면 하늘 정원에 소원바위, 코끼리 바위가 있고 밤이면 대구야경을 볼 수 있어요. 특히 단풍철이면 그 풍광이 넘 멋지답니다.",5.0
대구 동구 팔공산로185길 51,, 2018년 3월,0,128.6948362,35.9909143,팔공산케이블카,등산은 싫지만 올라가보고 싶을때...이용객이 그렇게 많지 않은듯 해서 많이 기다리지 않고 탈수 있어 좋음. 올라가서 전망대? 휴게소? 에서 파전에 동동주 조합으로 간단히 먹고 둘러보다가 내려 오기 좋은곳.,4.0
대구 중구 달구벌대로450길,, 2018년 10월,0,128.6072232,35.8612413,김광석 길,밤에 가면 더 화려한 김광석 거리낮에 가면 좀 어설퍼 보이는데 밤에 가보니 젊은이들과 장사꾼들 화려한 조명으로 감정이 들떠 흥분되는 거리다. 광장에서 키타를 치고 노래를 부르는 젊은이들로 김광석씨가 살아있는 느낌이다. 그러나 장사꾼들이 너무 많아 상업적인 냄새가 난다. 좀 더 문화적인 풍경을 만들었으면 했다.,4.0
대구 중구 달구벌대로450길,, 2019년 6월,0,128.6072232,35.8612413,김광석 길,장사치들로 가득한 상업화 거리상업화의 끝판왕  블로그에서나 보던 낭만적이고 음악이 흘러나오는 거리에서... 중국인과 한국인 관광객을 사로잡는 호객행위와 난잡한 가판대로 오염된 곳  예전의 그 멋은 전혀 없다 오로지 장사꾼과 길거리음식 불량식품 사진촬영 오락실로 도배된 거리  그저 지나가다가 한 번 들리고 말아야 할 곳... 주말이라 그런지 몰라도 정말 상상이상으로 중국인 관광객이 많았던 그런 곳..  길거리에는 오락실과 뽑기 불량식품 그리고 인생네컷이라 불리우는 즉석사진으로 도배되어있다  거리 가운데 작은 소공연장에서는,3.0
대구 중구 달구벌대로450길,, 2018년 11월,0,128.6072232,35.8612413,김광석 길,동네놀이터같은편안함규모가 크면 피로감이 많이 쌓이는데 그렇지 않아서 더 좋다 옛추억이 새록새록 떠오르기도하고 막걸리 한잔도 생각난다 소담하고 따뜻한 거리,4.0
대구 중구 달구벌대로450길,, 2019년 4월,0,128.6072232,35.8612413,김광석 길,노래들으며 걷는 길조금은 쌀쌀한 날씨였지만 저녁의 김광석거리는 낭만적이었어요.  버스킹도 많고 이쁜 카페덕분에 여행기분 났어요^^  길거리 쇼핑거리도 있어요,5.0
대구 중구 달구벌대로450길,, 2019년 3월,0,128.6072232,35.8612413,김광석 길,부모님도 만족하는 관광코스대구 내려가서 시간이 떠서 마땅히 갈 곳을 찾다가 방문했는데 재밌는 벽화 사진존도 많고 시장쪽에 맛집도 있어서 알찬 시간 보내다 왔어요ㅎ,4.0
대구 남구 앞산순환로 574-116,, 2019년 1월,0,128.5890545,35.8289965,앞산공원,대구 시내가 한눈에 들어오는 앞산!등산은 별로 좋아하지 않아서 고민없이 케이블선택! 케이블이 저녁늦게까지 운행해서 저녁야경보러올때 좋아요 >♡<  미세먼지때문에 답답한 요즘 속이 뻥뚫려요!,5.0
대구 남구 앞산순환로 574-116,, 2018년 10월,0,128.5890545,35.8289965,앞산공원,힐링이 되는 곳이에요^^동네 근처라 한번씩 산책하곤 하는데 몇년전에 혼자 등산을 한 적이 있어요~~ 저절로 힐링이 되고 피톤치드도 쐬고~~ㅎㅎ 정상 올라기전 케이블카 타는 곳에 커피명가 있으니 휴식하심 좋아욧,5.0
대구 남구 앞산순환로 574-116,, 2018년 7월,0,128.5890545,35.8289965,앞산공원,등산은 말리고 싶다..생각보다 경사져서 등산은 조금 ... 대신 케이블카 있으니 그거 타고... 야간되는 시즌엔 야간에 가서 야경보고... 근처에 카페 많으니 쉬면서 차 한잔 하면 좋을듯,4.0
대구 남구 앞산순환로 574-116,, 2017년 11월,0,128.5890545,35.8289965,앞산공원,"등산하기 좋습니다.성인 걸음으로 정상까지 왕복 3시간 정도 걸립니다. 가을, 겨울동안 등산을 자주 다녔는데요. 등산하기 참 좋은 산이라는 생각이 듭니다. 케이블카 도착위치에 있는 휴게소겸 음식점은 이름은 생각나지 않지만 보통의 산에 있는 식당에 비해 음식이 훌륭한 편입니다. 묵밥이나 비빔밥을 즐겨 먹었습니다.",4.0
대구 남구 앞산순환로 574-116,, 2018년 1월,0,128.5890545,35.8289965,앞산공원,새해 첫날 올라가는 곳전망이 좋아서는 모르겠고 새해에 첫 해 보러 가는 장소. 올라갈때 힘드니까 케이블카타고 올라가는게 좋음. 꼭대기부근에 오뎅사먹는곳 있음.,3.0
대구 중구 큰장로26길 45,, 2019년 2월,0,128.580781,35.8688986,서문 시장,"서문시장서문시장 먹으러간다  칼국수,수제비, 얼큰수제비 맛있다 지하상가쪽엔 다른 분식류도 많이팔고  양념오뎅도 맛있고 오뎅시식도준다",4.0
대구 중구 큰장로26길 45,, 2018년 10월,0,128.580781,35.8688986,서문 시장,국수골목에서 싸고 맛있게 먹어 보자서문시장은 먹거리도 많고 옷도 싸게 판다. 옷은 잘 골라야 한다. 엄청크고 넓어서  구경하는데도 시간이 걸린다. 먹자 골목에서 맛보기로 조금씩 음식을 사 먹어 보는것도 재미있다.  대구는  국수도 유명하다. 서문시장의 국수는 담백한 맛이다.,4.0
대구 중구 큰장로26길 45,, 2019년 5월,0,128.580781,35.8688986,서문 시장,"기분 좋게 해주는 전통시장전통시장은 아다시피 먹거리도 다양하고 싸서 좋고, 볼거리,  쇼핑할 거리가  많아  심심하거나  인간시장 , 즉 역동적인 삶을 구경하고 싶을때 , 시간 보내기에 딱  안성마춤이다. 아니, 구경하다 보면 후딱 시간이 너무  잘 간다.   trendy 하다고 할까 ? 요즘  유행하는 옷을 싼 가격에 살수 있어  매력적이다.  때로는 친구들과 같이 가방도 맞추러 가고 , 또 어떤때는  사온 옷을  바꾸러 가기도 좋은 것이 지상철 3호선도 있고, 버스도 많은 것이 대중교통이 더 빠르고  편리하다.",5.0
대구 중구 큰장로26길 45,, 2019년 4월,0,128.580781,35.8688986,서문 시장,서문시장여기저기 볼거리가 많다 건어물시장 음식시장 의류시장등  다양한제품 및 눈요기 거리가 많다 밤에는 야시장도 열린다 가봐라,4.0
대구 중구 큰장로26길 45,, 2019년 3월,0,128.580781,35.8688986,서문 시장,서문야시장사람이 너무 많아서 좀 기다려야 하기는 했지만 재밌는 경험이었습니다. 음식도 맛있고 재미 있는 야시장 경험이었습니디ㅏ.,5.0
"대구 Dohak-dong,Dong-gu",, 2018년 8월,0,128.7138793,35.9892801,동화사,최고의 힐링마음이 참 편안해지는 곳이다. 4계절 언제가도 자연이 예쁜곳. 날씨가 더 좋을 때 가면 산책하기 참 좋다. 천천히 걸으며 물소리를 듣고 푸른 자연을 보고 있으면 세상행복하다.,5.0
"대구 Dohak-dong,Dong-gu",, 2018년 7월,0,128.7138793,35.9892801,동화사,"산책대구에서 가장 큰 사찰이지만, 영화 세트장 같이 번쩍거리는 새 건물들에서는 어떠한 종교적 감정도 들지 않는다.  팁 일주문을 지나면 동화사 옛길로 올라갈 수 있는데 걷기에 아주 좋다",1.0
"대구 Dohak-dong,Dong-gu",, 2018년 6월,0,128.7138793,35.9892801,동화사,풍경좋은 사찰친구들이나. 외국분들과 함께 가기에 좋은 사찰입니다.  그러나 입장료가 너무 비싸다는 단점이 있습니다.  그것 외에는 사찰 내 길이나 분위기 모든것이 좋은 곳입니다,4.0
"대구 Dohak-dong,Dong-gu",, 2018년 3월,0,128.7138793,35.9892801,동화사,대구에서 가장 유명한 절입니다.동화사는 대구에서 유명한 유명한 절입니다. 이 절은 적극 추천입니다. 한마디로 강추입니다.,5.0
"대구 Dohak-dong,Dong-gu",, 2017년 7월,0,128.7138793,35.9892801,동화사,"대구 방문하면 꼭 들려야 할곳대구의 사찰중 가장 큰곳 팔공산과 그 주위의 암자들은 꼭 방문해야 할곳이다. 고려 왕건의 이야기와 더불어 도로명 지명 바위이름 (일인석,오인석),신숭겸 유적지 등 대구는 고려왕건과 견훤사이의 전투와 관계된 지명과 암자들이 많다",5.0
대구 중구 달성로22길 31-12,, 2019년 7월,1,128.5845613,35.8755076,대구예술발전소,대구 아트 팩토리 창조적 인 위치대구 아트 팩토리는 휴식을 취하고 예술 체험을 즐기는 곳입니다! 이곳은 완벽한 Instagram 사진을 제공하기 위해 보장됩니다.,5.0
대구 중구 달성로22길 31-12,, 2019년 7월,1,128.5845613,35.8755076,대구예술발전소,대구에서 신기한 시간대구에서 발견 된 매우 아름답고 독특한 아트 갤러리! 나는이 멋진 모든 인스 타 그램을 발견하게되어 매우 기뻤습니다. 아트 팩토리 주변의 가치있는 장소 ^^ 그곳으로 향하기 전에 휴대 전화를 충전해야합니다.,5.0
대구 중구 달성로22길 31-12,, 2019년 8월,1,128.5845613,35.8755076,대구예술발전소,아이코닉 자이언트 문 사진 영역당신의 마음의 내용을 볼 수있는 약 5 개의 레벨의 전시장이 있습니다! 1 층에 카페가 있으므로 음료에 대해 걱정하지 마십시오. 서명 + 상징적 인 거대한 달을 확인하는 것을 잊지 마십시오! ! ! (아래 비디오에서 어떻게 보이는지 확인하십시오)  Instagram @xuantravelogue에서 내 비디오를 확인하십시오.,5.0
대구 동구 팔공산로185길 51,, 2018년 10월,0,128.6948362,35.9909143,팔공산케이블카,한번쯤 타기 좋은 팔공산케이블카가격이 그리 저렴한 편은 아니지만 그래도 팔공산에 오면 한번쯤은 타보기 좋은 케이블카. 등산으로 걷는 것을 좋아하지 않는 사람이라도 팔공산의 탁트인 전경을 볼 수 있다. 가을에 단풍들때 타 보면 아름답다.,4.0
대구 동구 팔공산로185길 51,, 2018년 6월,0,128.6948362,35.9909143,팔공산케이블카,케이블카를 안타보았다면 추천 아니면...케이블카를 단 한번도 타보지 않으셨다면 타보시거나 아니면 팔공산을 가고싶지만 등산을 하기 싫다면 올라가보시는 것이 좋습니다. 저는 감흥이 없었어요,3.0
대구 동구 팔공산로185길 51,, 2017년 7월,0,128.6948362,35.9909143,팔공산케이블카,굿굿굿대구에 앞산/팔공산 케이블카 있는데 둘다 괜찮은 것 같아요 이전에 구매했던 표 가지고 가면 할인해주곤 했는데 확인해보시고 가세요,3.0
대구 동구 팔공산로185길 51,, 2017년 11월,0,128.6948362,35.9909143,팔공산케이블카,가을엔 특히 좋은곳팔공산은 대구 경산의 상징이자 주산입니다 특히 동화사와 갓바위란 유명한 사찰이 있어 사시사철 사람들이 많이 붐비는 산입니다. 보통 팔공산을 가면 등산을 하는데 가을엔 꼭 한번은 케이블카를 이용하여 산을 올라갑니다. 아름다운 단풍과 높은 하늘에 어우러진 팔공산을 케이블카에 바라보며 올라가면 더할 나위 없이 좋더군요.이번 11월초에도 케이블카를 탔었는데 요금이 아깝지 않을정도로 경치가 아름다웠습니다. ,4.0
대구 동구 팔공산로185길 51,, 2017년 2월,0,128.6948362,35.9909143,팔공산케이블카,"풍경 보기 좋은 곳생각보단 짧은 거리의 케이블카였지만, 그래도 팔공산 꼭대기에 올라가서 내려다본 대구의 전경은 멋있었음",4.0
대구 달성군 다사읍 강정본길 57,, 2017년 8월,0,128.4683413,35.8385261,디아크,"활동적이라면 낮에, 아니라면 밤에 ㄱㄱ장소가 넓어 자전거 대여해서 활동하기 좋음. 사람들이 주로 넓은 광장이랑 다리쪽에서만 노는데 서쪽으로 비포장 자전거 길 있다는걸 잘 모름. 때를 잘 맞추고, 밤에 가면 주변 조각물들과 디아크 건물이 빛을 뿜어냄. 그 주변에서 한바퀴 돌며 산책하는걸 추천하고, 건물 내부는 실망할거니까 들어가지 말길.",4.0
대구 달성군 다사읍 강정본길 57,, 2017년 11월,0,128.4683413,35.8385261,디아크,날씨 좋을때 아이들과 편히 갈수 있는곳제목처럼 날씨 좋을때 아이들 뛰어놀기 좋은곳. 음식 반입 제한이 없다는 것이 장점이지만 음식을 판매하는곳이 별로 없다는 상반된 단점이 있음. 너무 햇살이 강한날은 쉴만한 그늘이 없다는 것도 단점임. 하지만 별 제약 없이 아이들이 놀수 있는 공간인것만 해도 가족 나들이로 좋은 장소라 생각함.,4.0
대구 달성군 다사읍 강정본길 57,, 2017년 10월,0,128.4683413,35.8385261,디아크,바이크 타기 좋아용 ㅋㅋ날씨 좋은 날 친구들이랑 가서 바이크 타기 좋아요 ㅋㅋ 다만 대중교통이 조금 불편하여 차가 없으면 불편해요,4.0
대구 달성군 다사읍 강정본길 57,, 2017년 11월,0,128.4683413,35.8385261,디아크,"대구 디아크대중교통보단 자가용이나 자전거를 타러 가기 좋은 곳이다. 그늘이 없는 것이 흠이지만, 텐트를 치거나 야영을 하기에 괜찮은 곳이다. 디아크 내부도 돌아볼 수 있게 되어 있지만, 콘텐츠는 조잡한 편이고. 방문시 카페는 공사중이었다.",4.0
대구 달성군 다사읍 강정본길 57,, 2017년 11월,0,128.4683413,35.8385261,디아크,"시원하고 주변 환경과 전망이 좋아요조금 대중교통으로 접근하는것이 불편한점 빼고는 주변 환경과 전망이 좋아요. 여름에는 강바람이 시원하고 겨울에도 나름 운치가 있습니다. 특히 특이한 건물은 몰만 하구요, 실내 시설물고 나름 괞찬게 꾸며져있습니다. 주변에는 때때로 미술및 여러전시회가 열려 더욱 의미가 있더군요. 요금도 없고, 강변산책하기도 좋은 곳입니다. 아 디아크 꼭대기에서 바라보는 전망도 좋고, 야간에 조명받은 디아크도 볼만합니다.",4.0
대구 달서구 두류공원로 200,, 2017년 4월,0,128.5634167,35.8540248,83 타워,봄에 최고죠벚꽃 필 때 걷기 정말 좋은 명소  흐드러지게 핀 벚꽃길을 올라가기 좋음  다만 오르막길이라 주의,4.0
