address,category,date,is_foreigner,lat,lng,name,reviews,stars
"대구 Dohak-dong,Dong-gu",, 2018년 12월,1,128.7138793,35.9892801,동화사,동화사 불교 승려 방문나는 서구 국가들로부터 나의 리뷰를 읽는 사람들이 나보다 기독교에 대해 더 많은 것을 알고 불교보다는 기독교와 관련된 유물에 관심이없는 경향이 있기 때문에 대구의 예산 가톨릭 교회 대신 동화사 불교 사원을 소개하고 싶다. 특히 한자로 구성된 동화사에 대한시를 소개하고 싶습니다. 나는 이미 작은 책인 Stars Definitely Exist Even In The Daytime에 번역하고 출판했습니다. 이시는 조선 시대 작가 겸 유서 수 작가로 구성되었다. 이시의 제목은 동화사에서 불교 승려를,3.0
"대구 Dohak-dong,Dong-gu",, 2019년 11월,1,128.7138793,35.9892801,동화사,역사적인 사원동화 사원은 팔공산에 위치하고 있습니다. 대구에있는 학급이자 유서 깊은 사원입니다. 가을에 가면 색깔이 변하는 멋진 경치를 볼 수 있습니다.,4.0
"대구 Dohak-dong,Dong-gu",, 2019년 9월,1,128.7138793,35.9892801,동화사,"기차이것은 KTX 열차의 도시 정거장이며, 아마도 큰 도시이며 정거장을 둘러 보는 것이 좋습니다.",3.0
대구 달서구 화암로 342,, 2015년 7월,0,128.5204325,35.8011954,대구수목원,"아름다운 곳이에요대구 시내에서는 멀지만, 입장료도 무료에 산책하기 좋은 곳이에요. 봄, 가을에는 축제가 열리고 꼭 축제기간이 아니더라도 항상 꽃과 나무들이 조성되어있어서 아름다워요. 도심에서 멀어 여름에는 상대적으로 시원해서 쉬러오는 사람들도 많아요. 조금 넓지만 힘들다면 분재원, 다육식물원 등은 입구에서 너무 멀지 않아서 아이들이나 부모님과 가볍게 산책하기에도 좋아요.",4.0
대구 달서구 화암로 342,, 2014년 11월,0,128.5204325,35.8011954,대구수목원,국화 축제작년 2014년 마지막 국화 및 꽃 축제 시 대구 수목원을 방문 하였다 사람이 너무 많아 주차가 어려 워 대충 그 근처에 차를 대고 걸어서 방문 하였는데 여러 가지 국화로 만든 작품 및 꽃이 너무 멋있다 가을 마지막을 장식하는 꽃과 물 든 낙엽이 압권이다 올해는 좀 더 빨리 가야 겠다,5.0
대구 달서구 화암로 342,, 2015년 4월,0,128.5204325,35.8011954,대구수목원,산책하기 좋은 넓은 공간이에요갈때마다 다른 느낌이라 자주 가고 싶어져요 도심에서 좀 멀리 있지만 산책하고 싶으신 분들께 추천,4.0
대구 달서구 화암로 342,, 2015년 4월,0,128.5204325,35.8011954,대구수목원,봄 가을 생각나는 곳아이들과 가기에도 좋고 산책하기 아주 좋습니다. 꽤나 넓어 여기저기 볼것도 많고 봄 가을에 도시락 싸서 소풍가기 좋은곳 입니다.,4.0
대구 달서구 화암로 342,, 2015년 9월,0,128.5204325,35.8011954,대구수목원,"대구시민의 공원생각보다 좋았고, 교통이 좀 불편한 것 빼고는 모두 좋았다. 남녀노소할 것없이 산책하며 편히 쉴수 있는곳",3.0
대구 달성군 다사읍 강정본길 57,, 2016년 2월,1,128.4683413,35.8385261,디아크,이상하지만 멋진 건물을 보고나는 트립어드바이저에서 검색 결과입니다 빌딩입니다. Pop 를 위해 방문하기 결정했습니다. 날씨가 좋지 않은 강이 있어서 대단히 도움 :(  다른 것을 볼 수 있지만 경치가 있어서 가치가 있다. 꽤 많은 사람들이 명백하게 구축 및 최신 정보를 알 수 없지만 나는 그에게 알려야 한다는 것이 좋은 로맨틱한 data protection advisor에 방문하기. 또한 시간 때에 가면 열 수 있습니다. 제가 갔을 때는 밤에 문을 닫는 카페가 있는 꼭대기 층에 있어서 편히 쉴 수 있는 작은. 즐길 수,5.0
대구 달성군 다사읍 강정본길 57,, 2015년 11월,1,128.4683413,35.8385261,디아크,큰 이벤트 장소경주에 있는 두 개의 실행 단계 10K 호. 모두가 잘 운영되는 사건 들이 매우 친절하고 모든 참여자가 호 아름다운 장소. 위치는 아름다운 공원.,5.0
대구 달성군 다사읍 강정본길 57,, 2015년 6월,1,128.4683413,35.8385261,디아크,"좋은 공원. 지루한 장소호는 이상한, 과대 평가 박물관. 하지만, 이 위치에 있는 아주 좋은 장소입니다. 공원을 즐길 수 있는, 웃음이 호. ",1.0
대구 달성군 다사읍 강정본길 57,, 2015년 3월,1,128.4683413,35.8385261,디아크,"아키텍처 -; 교통 플러스-마이너스호의적인 구축에 대구. 외부 디자인은 꽤 재미있는 형상 및 텍스처. 영구 전시 는 교육 및 하이테크 정보. 이 짧은 애니메이션 도 멋지지만 360 스크리닝용 에 나타나지 않은 테마 한공중웹콜폰과 무역법등 이동. 에서 바라본 상단 중앙이 얼마나 안전빔 얼마나 물이 영역에서. 이곳은 멋진 풍경은 아니지만, 적어도 이 계절의 사진 전시회에 전시 중인 여러 장소와 시설. 내부 카페 이지만 느낌은 한결같은 어두웠고 닫히 부족하여 창문 설계 호 카운티까지 네 거의 2 행 끝에 지하철과 버스는 가끔 택시 및",3.0
대구 중구 달구벌대로450길,, 2017년 5월,0,128.6072232,35.8612413,김광석 길,벽화도 근사하고 이런저런 먹거리도 즐길 수 있어 좋아요벽화도 근사하고 이런저런 먹거리도 즐길 수 있어 좋아요. 작지만 공연장도 있어 쉬어가며 음악을 들을 수도 있구요. 개성있는 음식점과 카페가 늘고 있어 또 방문하고 싶은 곳입니다.,4.0
대구 중구 달구벌대로450길,, 2016년 12월,0,128.6072232,35.8612413,김광석 길,"김광석을 좋아한다면 반드시 가봐야 할 길김광석이 살았던 방천시장 인근 골목을 여러 작가들이 그림으로 수놓은 기념길입니다. 레전드 김광석이 웃는 그림들, 안주를 내어주는 포장마차의 김광석 등.. 감성적인 벽화에서 사진을 찍기에 좋았어요. 대구여행에서 빼놓을 수 없는 관광명소입니다. :)",5.0
대구 중구 달구벌대로450길,, 2017년 4월,0,128.6072232,35.8612413,김광석 길,"아! 김광석~대구까지 가서 김광석길을 안 보고 올 순 없지 싶어서 일부러 찾아갔는데 너무나 아련하고 골목을 아기자기하게 잘 꾸며놨더군요. 버스킹하는 가수들도 보이고 교복 입은 학생들부터 아주머니떼, 중년의 남성들까지 모두가 먼저 간 광석님을 아련히 추억하는 모습이 인상적이었습니다. 다만 길이 너무 좁고, 주차공간이 없어 불편했습니다.",4.0
대구 중구 달구벌대로450길,, 2017년 4월,0,128.6072232,35.8612413,김광석 길,여유 커피 그리고 버스킹일요일 아침에 방문 했는데 버스킹 하는 분들이 아름다운 노래도 들려주고 카페랑 거리도 예쁘고 너무 좋았어요. ,5.0
대구 중구 달구벌대로450길,, 2017년 3월,0,128.6072232,35.8612413,김광석 길,의외로 아기자기함이 돋보인 길개인적으로는 체코의 존 레논 거리나 벽 보다 훌륭한 듯.. 기대를 너무 안하고 가서인가.. 가수의 음악도 멋지고 먹거리도 많고.. 아기자기하고 특색있는 가게들이 많아 좋았다,4.0
대구 남구 앞산순환로 574-116,, 2015년 3월,0,128.5890545,35.8289965,앞산공원,뒷산말고 앞산 가봤나? ㅋ눈이 확 트이고 정말 힐링 필링 달링 대구와 같은 휴양! 가족이나 연인 그리고 자녀분들과 함께 도시의 사색을 만끽 하실 수 있는 곳으로 강추!,5.0
대구 남구 앞산순환로 574-116,, 2014년 10월,0,128.5890545,35.8289965,앞산공원,앞산공원대구를 잘 볼 수 있는 전망이 좋은 산(대덕산)이 있으나 등산하면서 느낄 수 있는 좋은 경치는 별로인듯. 케이블카를 타고 갔던 기억이 있음,2.0
대구 남구 앞산순환로 574-116,, 2014년 9월,0,128.5890545,35.8289965,앞산공원,너무 가파름케이블카가 있어서 케이블카 타면 힘들지 않고 구경할 수 있어요. 대구 중심가가 한눈에 내려다 보여요,3.0
대구 남구 앞산순환로 574-116,, 2015년 8월,0,128.5890545,35.8289965,앞산공원,가까운곳에서 힐링대구근교의 산중에서 등산과 산책코스가 아주 다양한곳입니다. 도심에서 이렇게 다양한 코스의 등산코스를 찾긱란 어려울 것입니다. 특히 야간에도 다닐수있는 산책로등이 개방되어있어서 무더운 날에는 야간 산행도 해볼수 있는 아주 좋은곳입니다..,5.0
대구 남구 앞산순환로 574-116,, 2015년 7월,0,128.5890545,35.8289965,앞산공원,산책하기 좋은 산간단히 산책하기 좋은 산입니다. 케이블카가 있는 곳은 이제 공사가 끝나서 전망도 좋습니다. 신천주변으로 있는 등산로에는 저렴한 식당들이 많습니다.,4.0
대구 중구 남성로 51-1,, 2015년 3월,0,-1,-1,대구 약령시 한의약 박물관,아이데리고 체험갔었습니다.약령시가 대구의 문화거리로 발돋움하고 약령시축제등도 개최하여  조금이나마 활기를 불어넣어주고 있어 좋습니다.축제때는 사람이 너무 많아  한적한 평일에 갔더랬습니다. 저렴한 가격에 몇가지 체험도 즐길수 있어서 아이가 좋아하네요. 애들데리고 견학가볼만하다고 생각합니다.,4.0
대구 중구 남성로 51-1,, 2015년 9월,0,-1,-1,대구 약령시 한의약 박물관,"대구 약령시의 상징대구 약령시를 간단하게 요약해놓은듯한 박물관, 규모는 크지 않으나 내용은 실속있고, 연휴에도 직원들이 성실하게 근무중",5.0
대구 중구 남성로 51-1,, 2015년 6월,0,-1,-1,대구 약령시 한의약 박물관,괜찮음한의약 박물관 시원하고 좋아요  타지방 사람들도 많이들 방문하더라구요~ 접근성도 좋고 근처에 볼거리도 많아서 추천,5.0
대구 중구 남성로 51-1,, 2015년 5월,0,-1,-1,대구 약령시 한의약 박물관,대구를 대표하는 박물관대구를 대표하는 약령시 박물관입니다. 가족단위로 방문하기에 좋습니다. 깊은 한약냄세를 느껴보세요.,4.0
대구 중구 남성로 51-1,, 2015년 6월,0,-1,-1,대구 약령시 한의약 박물관,"한번 가볼만함거창한건 없지만 일단 입장료가 무료이고 한방에 관해 전시해두었음 비누만들기, 족욕?등 체험관 있음. 미리 신청하면 할수있음 (이건 돈들어감) 기대치가 없어서 인지 생각보단 괘안았음",4.0
대구 달서구 두류공원로 200,, 2017년 6월,1,128.5634167,35.8540248,83 타워,멋진 전망몇 좋은 곳. 타워 꼭대기에 있는 좋은 볼 수 있습니다. 나는 테마 파크에 가서 83타워. 나는 타워 꼭대기에 가는 좀 더 지불했는데 싸게. 나는 아이스 티 일어나 바에 앉아 있었다. 밤에 보기 적극 추천합니다! ! !,5.0
대구 달서구 두류공원로 200,, 2017년 3월,1,128.5634167,35.8540248,83 타워,"욕실만 놓고 가.변경다른 유사한 타워 지역. 멋진 전망, 좋은 욕실은 타워 에 위치하고 있지만. 욕실과 멀리 보기엔 갈 수 있습니다.",4.0
대구 달서구 두류공원로 200,, 2017년 1월,1,128.5634167,35.8540248,83 타워,"매우 실망나는 흥분 한 후 방문하기 좋은 경험에 83 타워 n 서울 타워. 리뷰를 읽고 얼마나 아름다운 밤 였습니다. 하지만 슬프게도. 저는 실망했습니다. 보기 영역 은 정말 작았고, 아직 전에 테이블과 의자가 였다. 잡을 방법도 없는 창에 있는 뷰 를 엿볼 수 있는 사람들이 느낄 공포증에 할 수 없습니다.   추천하지 않는 것이 아니라면 무료로 쓰이는 전자 - 월드 티켓. 그렇지 않은 경우. 제가 추천하는 그보다는 전망이 아름답게 불 - 최대 외부에서 오렌지 타워.",2.0
대구 달서구 두류공원로 200,, 2016년 12월,1,128.5634167,35.8540248,83 타워,"보기 좋은 도시우리는 우리의 방문은 타워 무료 티켓 으로 e - 세계. 타워에서 도시의 전망이 좋고, 창문이 더러워서 사진 촬영 은 불가능합니다. 대구 타워는 서울 n 타워.",3.0
대구 달서구 두류공원로 200,, 2016년 8월,1,128.5634167,35.8540248,83 타워,"좋은 도시 풍경.아이스 링크가 있는 타워! 이 확실하지 않은 특별한 경우지만 전 스케이트 이 유쾌한 후에 수행할 수 있는 아이스 스케이팅을 하고 난 뒤 부터 일부 최고! 이 곳에서 쉽게 걸어갈 수 있는 (2? ) 지하철, 모든 맨 타워. 우리는 로프 점프 하고 싶지만 시간이 열 생각하지 않습니다.   E - 세상은 그 아래. 좋은데 정말 높고 뷰에서 도시, 산이 어쩌면 더욱 효율적으로 수행할 수 있습니다. 이는 단지 몇몇 사람들과 쉽게 가는 엘리베이터를 좋아해 하이킹.   모든 종류의 것들이 있는 좋은 정원 에",4.0
대구 중구 큰장로26길 45,, 2016년 10월,0,128.580781,35.8688986,서문 시장,"야시장 볼만 합니다~주말엔 사람이 득실득실합니다 ㅎㅎ 볼거리보다는 먹거리 위주이고 낮엔 좌판에 국수, 분식류 등 먹거리와 서울의 동대문시장 같이 저렴하게 옷이나 신발들을 구매할 수 있어요~",4.0
대구 중구 큰장로26길 45,, 2016년 9월,0,128.580781,35.8688986,서문 시장,"시장이 정말 크고, 채소, 생선 등 먹을거리들이 신선해서 좋아요.시장이 정말 크고, 다양한 먹을거리들이 종류도 많을 뿐만 아니라 신선해서 좋아요. 비교해서 고르기도 좋구요. 특히 야시장은 볼거리도 많고, 간식거리가 많아서 즐거워요.",4.0
대구 중구 큰장로26길 45,, 2016년 6월,0,128.580781,35.8688986,서문 시장,"먹거리, 볼거리, 즐길거리 많은 곳시장 여기저기 다니며 호떡, 어묵, 만두, 국수 등으로 배채우고 유아의류, 어른의류, 악세사리, 주방용품 등 없는 것 빼고 다 있어 구경하기 좋은 곳. 3호선이 가서 대중교통도 편한 곳",4.0
대구 중구 큰장로26길 45,, 2016년 2월,0,128.580781,35.8688986,서문 시장,시내에서 가깝고 가장 큰 재래시장다양한 구경거리도 많고 먹거리도 많아요. 요즘은 시장안에 카페도 많이 생겨서 떡볶이나 국수 칼국수 도너츠부터 케익 커피 다양하게 먹을수 있어서 좋구요  2지구에는 원단이나 한복도 구경할수 있어요. 한복은 서문시장이 제일 싼거같아요!! 저렴하게 한복구매해보세요!,5.0
대구 중구 큰장로26길 45,, 2016년 4월,0,128.580781,35.8688986,서문 시장,"대구의 매력은 재래시장에..대구에는 동네마다 하나씩 재래시장이 살아있다. 정작 대구분들은 재래시장이 서민생활과 물가안정에 얼마나 기여하고 있는지 잘 모르는 것 같다. 서문시장은 먹거리, 입을거리 구경만 해도 충분히 즐길게 많은 곳이다.",4.0
대구,, 2016년 2월,0,128.601445,35.8714354,대구도시철도,중앙로역에서 할 수 있는건 쇼핑뿐젊은이들이 대구에 오면 사실 할 수 있는게 거의 전무하다. 대구 중앙로는 서울 명동의 축소판인데 타지인들에게 메리트가 없다,3.0
대구,, 2015년 3월,0,128.601445,35.8714354,대구도시철도,도심지너무 복잡한 장소이지만 환승을 위해서는 거쳐야 되는 곳입니다.  서울 지하철보다는 덜 복잡합니다.,3.0
대구,, 2015년 8월,0,128.601445,35.8714354,대구도시철도,리모델링이 시급깔끔하지 않고 리모델링이 시급해보입니다. 위치는 중요한 곳에 위치하나 반월당역과 너무 차이가 많이 납니다.,2.0
대구,, 2015년 8월,0,128.601445,35.8714354,대구도시철도,대구 시내 중심역대구 시내의 중심 역 중 하나입니다. 대구의 여행지 및 맛집에 가려면 이 역을 지나치거나 이 역에서 내려서 가야 합니다.,3.0
대구,, 2015년 9월,0,128.601445,35.8714354,대구도시철도,대구중심상권지하철대구 중심가 지하철역. 지하상가로 이어져 동성로로 갈수있는곳입니다. 지하상가에서 롯데영플. 교보문고등으로 이어집니다,4.0
대구 달서구 화암로 342,, 2015년 6월,0,128.5204325,35.8011954,대구수목원,"아름답고 넓은 곳입장시간이 제한적인것이 안타깝지만, 아름답고 깨끗하게 관리되고 몇번을 가도 계절별로 다른 아름다움이 있는곳입니다.",4.0
대구 달서구 화암로 342,, 2015년 4월,0,128.5204325,35.8011954,대구수목원,"힐링, 필링, 달링, 인조잉 잉?듣자하니 이전 매립지를 매꿔서 만든 친자연적....에코투어리즘의 대명사인 이곳! 정말 매립지였다고 해도 믿지않을만함 자연의 천혜를 느끼고 힐링 할 수 있었던 명소!",5.0
대구 달서구 화암로 342,, 2015년 6월,0,128.5204325,35.8011954,대구수목원,대구에서 가장 멋진 수목원대구에서 가장 큰 수목원입니다. 예전 이곳이 쓰레기장이었다는 것이 믿기지 않을 만큼 잘 되어 있습니다. 많은 식물들을 만날 수 있고 특히 봄과 가을에 가면 더 멋진 것 같습니다. 다만 대중교통으로 가기는 조금 불편합니다. 지하철 역에서 내려서 꽤 걸어가야 합니다.,4.0
대구 달서구 화암로 342,, 2015년 6월,0,128.5204325,35.8011954,대구수목원,문안한 곳산책하기 좋은 곳입니다. 차량 통제가 잘되어 있어서 애들 데리고 다니기에도 좋습니다. 여러가지 식물들이 있긴하지만 화려한 것들은 없습니다.,4.0
대구 달서구 화암로 342,, 2015년 6월,0,128.5204325,35.8011954,대구수목원,우와~~2번째대구여행~~ 1번째는먹방~2번째는관광좀즐겼습니다.. 생각보다대구에는관광지가별로없더라고요.. 근데이게왠걸ㅋㅋ생각지도못하게대구수목원에도착ㅋㅋ엄청큽니다ㅋㅋ예전엔쓰레기처리장?이었다고하네요..이젠대구시민들을위해서수목원으로발전~~수많은나무..꽃들..화려하진않지만웅장?하다고해야하나..공기도너무좋고..특히연인들끼리사진찍기너무좋은장소인듯합니다..사이사이에토끼가돌아다니고ㅋㅋ시내안에있는수목원이라고는믿기지않을정도의신선함을느끼고온듯하네요~ㅋ,4.0
"대구 Dohak-dong,Dong-gu",, 2019년 7월,1,128.7138793,35.9892801,동화사,멋진 전망!나는 가족과 함께 거기에 갔다. 그곳을 처음 방문한 사람들과 많은 사람들이 방문했습니다. 대구의 유쾌한 사원입니다. 거기서 잠시 산책 할 수 있습니다. 그리고 큰 부처님 동상을 볼 수 있습니다. 먼저 팔공산 케이블카를 타면 할인 혜택을받을 수 있습니다.,4.0
"대구 Dohak-dong,Dong-gu",, 2019년 7월,1,128.7138793,35.9892801,동화사,"거 대 한 부처님 동상으로 아름 다운 경내입니다.대구에 머물면서 동화 사를 방문했다. 경내는 Dongghdaegu 역에서 빨간색 1 버스를 경유하여 약 30 분 (19 정거장) 위치하며, 역 뒤 거리의 버스 정류장에 위치해 있습니다 (역 자체가 아닌 것처럼 찾기가 까다 롭습니다). 일단 당신이 땅에 도착하면, 사원까지의 오름의 약간의 오름이다. 그러나 그것의 꽤 가치가있다. 약간의 다른 사원이있다. 그러나 또한 주된 사원과 정반대의 방향에서 10 분 도보 인 거대한 Buddha 상에 도착하는지 확인해라. 그것은 그만의 가치가있는 방문입니다.",5.0
"대구 Dohak-dong,Dong-gu",, 2019년 4월,1,128.7138793,35.9892801,동화사,볼 수있는 가장 큰 부다 (Budda)의 가장 큰 사원 스타일.세계에서 가장 큰 약사 인 사원이 많이 있습니다. 매우 넓은 지역. 팔공산 케이블카에서 가깝습니다.,3.0
"대구 Dohak-dong,Dong-gu",, 2018년 11월,1,128.7138793,35.9892801,동화사,조용하고 평화로운입장료는 1 인당 2500 원입니다. 그것은 약 20-30 m의 위로 걷는다. 그러나 환경은 그것을 보람있게했다. 계단을 건너 뛰어도 차를 타고 더 걸릴 수 있습니다.,4.0
"대구 Dohak-dong,Dong-gu",, 2017년 5월,1,128.7138793,35.9892801,동화사,좋은 불교 사원제가 한국에서 방문한 많은 사원들이 정말 좋은 것 같다고 생각 동화사. 약간의 가치가 있는 도시 중심가에서 멀리 떨어진 곳 입니다. 다음에는 꼭 템플 스테이를 하는 것 입니다!,5.0
대구,, 2015년 8월,0,128.601445,35.8714354,대구도시철도,"대구의 중심지대구의 중심지 입니다. 동성로와 연결되어 있어요. 근처에 CGV대구, 아카데미, 한일 등 CGV극장이 밀집되어 있고 다양한 맛집도 있어요. 그리고, 중앙로는 대중교통지구라 버스만 다니기 때문에 길도 안막혀요.",4.0
대구,, 2015년 2월,0,128.601445,35.8714354,대구도시철도,동성로에서 가장 가까운 역.대구 지하철 중앙로역은 대구의 동성로와 가장 가까운 지하철 역입니다. 또 지하상가와 바로 연결되어 있어서 더운 여름에 지하로 다닐 수 있어서 좋았습니다.,3.0
대구,, 2015년 8월,0,128.601445,35.8714354,대구도시철도,복잡한 도심속의 복잡한 지하철환승역이 아니지만 도심 주변이라 복잡한 편입니다. 대구백화점이나 구한일극장이었던 cgv에 방문하기에 적합한 곳입니다.,3.0
대구,, 2014년 10월,0,128.601445,35.8714354,대구도시철도,"대구 지하철의 중심중앙로역은 대구 도심에 위치한 역으로 대구의 최고 번화가인 동성로와 연결되어 있습니다. 중앙로역에서 동성로쪽으로 가면 대구백화점이 위치한 대구 최고의 번화가가 나오고 대구역쪽으로 걸어가면 교동시장, 귀금속시장이 있는 곳이 나옵니다. 중앙로역은 지하상가도 잘 되어 있어서 구경하면서 걷는 재미가 솔솔합니다. 교보문고랑도 연결되어 있구요. 중앙로역은 2003년 대구지하철 참사가 일어났던 아픈 기억이 있는 역이기도합니다.",4.0
대구,,,0,128.601445,35.8714354,대구도시철도,"역 지하는 헷갈립니다.한국은 큰 도로 지하에 지하상가를 만들었는데 중앙역 지하 상가는 넓고 방향이 여러 갈래로 나누어져서 헤매기 쉽습니다. 북적거리고 상점도 상품도 많아서 즐겁긴 합니다. 근처에 문화의 거리라고 하는 갤러리가 있는 길이 있는데 약 거리, 과자 거리, 수제화 거리 등 지상은 거리에 따라 파는 물건이 나누어져 있어서 매력적입니다.",4.0
대구 중구 남성로 51-1,, 2015년 7월,0,-1,-1,대구 약령시 한의약 박물관,"꼭 한번 가보셔야되는 곳대구에 오신 귀빈 내외빈들께 적합한 우리나라의 한의약과 대구의 특산품, 한방투어리즘의 진수를 보여주는곳으로 사료됨. 영문, 한글로도 표기되어있어 관광 및 설명에 수월함.",5.0
대구 중구 남성로 51-1,, 2015년 5월,0,-1,-1,대구 약령시 한의약 박물관,한의약 및 체질에 대한 정보와 여러가지 볼거리가 있었습니다.한의약 및 체질에 대한 정보와 여러가지 볼거리가 있었습니다. 앞마당에는 간단하게 즐길수 있는 옛놀이가 준비되어 있었습니다,4.0
대구 중구 남성로 51-1,, 2015년 7월,0,-1,-1,대구 약령시 한의약 박물관,약령시 한의약 박물관우리나라의 한약을 많이 볼수 있으나 크게 재미는 없었든 기억이 있음. 크게 기대는 하지마시길.,3.0
대구 중구 남성로 51-1,,,0,-1,-1,대구 약령시 한의약 박물관,별로저는 영어를 잘하지 못합니다. 영어 통역사는 제 질문을 다 이해하지 못해서 원하는 대답을 들을 수가 없었어요. 유감입니다.,5.0
대구 중구 남성로 51-1,,,0,-1,-1,대구 약령시 한의약 박물관,"일본어 팸플릿 있음입구에서 이름과 주소를 기입했습니다. 거기에 팸플릿이 진열되어 있는데, 일본어 팸플릿도 있었고, 게다가 접수하시는 분이 안내해주셨습니다. (그때 관람객은 저 혼자였기 때문에 안내해주신 걸지도?) 접수하시는 분은 일본어를 못하셨지만, 각 코너에서 설명을 들을 때 일본어 버튼도 있어서, 한국어를 몰라도 이해할 수 있었습니다. 체험 코너도 있어서, 치마저고리를 입고 사진도 찍을 수 있었기 때문에, 즐거운 시간을 보낼 수 있었습니다.",4.0
대구 남구 앞산순환로 574-116,, 2015년 5월,1,128.5890545,35.8289965,앞산공원,전망대에서 보는 야경 좋아요앞산둘레길 산책하기도 좋고요. 힘들다 하시면 케이블카(로프웨이)타고 전망대 구경만 가셔도 괜찮아요. 낮에 등산하고 전망대 가시던가 아님 야경보러 가셔도 좋아요. 야간산행도 많이들 간답니다.,4.0
대구 남구 앞산순환로 574-116,, 2019년 12월,1,128.5890545,35.8289965,앞산공원,앞산 공원 / 케이블카 / 전망대길에서 걷지 않고 앞산 케이블카 지점에 택시 기사를 데려다 줄 수 있습니다. 도심으로 돌아 오는 길에 카페 직원이 택시를 불러서 운전자와 의사 소통하는 데 큰 도움이 되었습니까?,4.0
